<?xml version="1.0" encoding="UTF-8"?>

<!DOCTYPE hechosHistoricos SYSTEM "hHistorico.dtd">
<hechosHistoricos>
    <hechoHistorico descripcion="Hola">
        <fecha>
            <formatoFecha>
                <dia>01</dia>
                <mes>01</mes>
                <year>2022</year>
            </formatoFecha>
        </fecha>
        <epoca/>
        <personajeDestacado>
            Test persona <nombre></nombre> y fecha de nacimiento: <fechaDeNacimiento></fechaDeNacimiento>
        </personajeDestacado>
    </hechoHistorico>
    <hechoHistorico descripcion="Hola">
        <fecha>
            2022-10-09
        </fecha>
        <epoca/>
        <personajeDestacado></personajeDestacado>
        <personajeDestacado></personajeDestacado>
    </hechoHistorico>
</hechosHistoricos>